,sector,text
3,5.4,"Employment

The Labour and Employment Act 2007 govern the employment and working conditions in Bhutan. One of the objectives of the Economic Development Policy 2010 is to achieve full employment by 2020. Full employment is defined as employment of 97.5 percent or unemployment rate of 2.5 percent.

Employment is defined as ""if a person has performed some paid work in cash or in kind, during the reference period for at least one hour or the person has a job or business formally attached but temporarily absent from the work and going to resume the work"". ""Reference period refers to the week preceding the date of the survey interview""35. Labour Force Surveys are conducted by the Ministry of Labour and Human Resources on an annual basis.

5.4.1  Current Situation

The overall unemployment rates increased from 1.4 percent in 1998 to 4.2 percent in 2008 and have since then declined to 2.1 percent in 2012. Similarly at disaggregated levels, unemployment has decreased by area of residence (rural/ urban), by gender and by youth in 2012.

Agriculture sector continues to be the largest employer accounting for 62 percent of total employment, followed by public administration at 8 percent, manufacturing at 5 percent and others contributing less than 5 percent. In terms of gender, the percentage of females employed are higher in agriculture, wholesale and retail trade, and hotels and restaurants sectors.

In terms of the nature of employment, majority of those employed are agriculture family worker36 representing 39.5 percent followed by regular paid employee consisting of 23.9 percent of the total.

At the Dzongkhag level, the unemployment was highest in Thimphu with an unemployment rate of 4.3 percent followed by Sarpang, Trongsa, Tsirang, Dagana, Paro and Zhemgang all registering unemployment rates higher than the national average of 2.1 percent. Gasa, Bumthang, Pema Gatshel and Samdrup Jongkhar had unemployment rate of less than 1 percent.

5.4.2  Key Challenges

Quality of employment - While we have been successful in reducing unemployment rates, the review of LFS 2012 indicates that the quality of employment could be improved.

•	The agriculture and forestry sector continue to be the largest employer while contributing least to GDP growth rate. The impressive economic growth achieved by the secondary and tertiary sectors has not translated into jobs, thereby indicating some levels of inequity in economic growth.

•	Even among the employed many are still vulnerable and lack income and social security as 40 percent of those employed are agriculture family workers. Women are particularly vulnerable as they comprise 27.6 percent in this category.

•	About 68.9 percent of those employed in the agriculture sector worked for more than 48 hours of which 46.1 percent reportedly work more hours to increase earnings indicating low income for those employed in the sector.

•	Only 33 percent of those employed earned monthly incomes of Nu. 10,000 or more.

•	In terms of the level of education, 53.6 percent of those employed were illiterate with the next highest level being middle secondary school level dropouts at 11 percent. Only 4.1 percent had either an undergraduate or Bachelors degree. This indicates either a poor synergy between the education system and manpower needs resulting in a lack of skilled manpower or a mismatch of potential employees and jobs available.

Creation of new jobs: During the next five years, approximately 120,000 jobs seekers will be entering the labour market. Out of this, 60 percent will be those with education qualifications of Class X and higher. While this presents an opportunity of a large number of educated job seekers, creating jobs that meets the aspirations of these qualified youth will be a major challenge. The Labour Force Survey 2012 estimates that the unemployment rate among the middle secondary education group was the highest at 22.8 percent. This was followed by the higher secondary education group at 20.4 percent and Bachelor Degree group at 12.3 percent.

Projections based on the employment elasticity  of sectoral growth reveal potential for creating 120,000 jobs for corresponding number of job seekers in the Eleventh Plan. The services sector presents the highest potential for absorbing job seekers followed by industries and agriculture.

The jobs in service sector - hotels and restaurant; transport, storage and communications; wholesale and retail; real estate, renting and business activities - are expected to grow as a result of doubling of tourist arrivals from 100,000 to 200,000 and initiation of seven new mega hydropower projects during the Eleventh Plan. The jobs in the industrial sector are also expected to grow with the commissioning of three new hydropower projects, establishment of power intensive industries and construction activities related to mega hydropower projects. The share of agriculture sector for new employment is expected to be very low, in absence of any other policy intervention.

Hence, jobs will be available but the greater challenge would be to match supply of jobs with the right skills in the labour market.

5.4.4  Strategies

The main objective of this sector is to achieve full and productive employment. Strategies to achieve this objective include

•	Implementation of the Rapid Investments in Selected Enterprises (RISE) programme;

•	Private Sector Development;

•	Institutionalizing multi-sectoral coordination committee to strengthening linkages between the education system and manpower needs of the country to address the mismatch of skills and aspirations;

•	Incentivizing business and industries that give priority to employment of Bhutanese; and

•	The government will also explore decent and productive overseas employment particularly for the youth.

In the Eleventh Plan, about 82,000 new jobs need to be created for approximately 120,000 job seekers, to ensure full employment of 97.5 percent. The tentative sector-wise new jobs required to be created is presented below. The projections are based on past trends and new potential such as construction of seven new mega hydropower projects and doubling to tourist arrivals in the Eleventh Plan.

5.4.5  Key Programmes

•	Promotion of full and productive employment

•	Promotion of decent working conditions and work environment Programme details are presented in Eleventh Plan Volume II document."
4,5.5,"Renewable Natural Resources (RNR) Sector

RNR sector comprises of agriculture, livestock and forestry. For an agrarian country like Bhutan, the RNR sector plays a vital role in bringing about equitable development through enhancing rural prosperity and poverty alleviation. About 62.238 percent of the population directly depended on agriculture for their livelihood.

However, in spite of the changes and innovations infused over the years to propel RNR sector growth, the sector's growth remained insufficient to adequately address rural poverty, attain food security and to sustain the overall economic growth. The sector's full potential is challenged by low productivity due to issues such as acute shortage of farm labour driven by outbound rural-urban migration, loss of arable land to urbanization, difficult terrain, fragmented land holdings, loss of crops to wildlife, lack of access to market and agricultural credit, climate change and natural disasters, post harvest management issues and subsistence nature of farming. Consequently, dependence on import of food and food grains remain high and returns to farmers remain small as a result of higher costs of production and low economies of scale.

5.5.1  Current Situation

Based on food availability, access and nutrition, Bhutan is modestly food secure. 60 percent of cereal, vegetables and animal products are domestically produced, and 95 percent of fruits and nuts are domestically available, with apples and oranges enough to be exported. However 97 percent of fish, 80 percent of beef and 77 percent of pork demand and 90 percent of oils and fats are still met from imports (as of 2010)38. In terms of access, about 3 percent of the population spends less per person than the food poverty line of Nu. 1,154.7439. The nutritional status40, measured in terms of stunting prevalence, while reduced from 56 percent in 1988 to 33.5 percent in 2010, still remains high.

RNR sector is also the largest employer. As per Labour Force Survey 2012, 62.2 percent of those employed were in RNR with 23.9 percent male and 38.4 percent female. The survey also reveals that among all occupation groups, 68.9 percent of those employed in agriculture worked for more than 48 hours per week due to the sector providing the lowest monthly income in all occupation groups.

The share of agriculture to real GDP has declined by more than half from 25 percent in 2001/02 to 12 percent in 2011/12 mainly because of higher growth in other led by the electricity and construction and also due to various challenges faced by the sector itself. In terms of nominal GDP in current prices, agriculture contribution has doubled from Nu 6 billon in 2001/02 to Nu. 14 billion in 2011/12.

5.5.2  Key Challenges

Loss of agriculture land and declining productivity - Achieving food self-sufficiency would largely depend on area under food grain cultivation and yield per hectare. Both are on the decline. Rapid development and urbanization has put a lot of pressure on agriculture land. According to the Department of Agriculture's estimates, about 2000 acres of agricultural land was lost to non-agriculture development purposes during 1998-2008. This is likely to increase in the near future with increased development activities unless effective measures are put in place to protect prime agricultural lands.

Studies also indicate that yield per hectare has been on the decline at a compounded annual rate of 1.84 percent over the last 27 years. This could be attributed to various factors such as declining investment in the agriculture sector, loss of prime agriculture land to other use, climate change, land being kept fallow due to shortage of farm labour/irrigation, loss of crop to wildlife and limited scope of mechanization. Unless these issues are addressed in the Eleventh Plan, achieving food self-sufficiency goal in the Eleventh Plan will still remain a challenge.

Agriculture Environment and Challenges - Agriculture farming is characterized by steep geographic terrain. With the exception of few wide valleys in the western, central and some plains in the southern part of the country, in most part agricultural lands are located on the slopes. Assessment indicates that 31 percent of the agriculture land is located on slopes more than 50 degrees. This is also one of the reason why soil erosion rate is high, estimated at 8.6 tonnes/ha or approximately 3.5 t/acres (DOA, 2011).

Moreover, despite having an abundance of water resources, agriculture is still dominated by the rain-fed dry land farming and wetland cultivation. Of the 77,493 acres of ""chuzhing"" only 59,243 acres are serviced with improved irrigation system. Dry land irrigation for other crops is virtually non-existent.

Further, pest and diseases continue to be a problem for the farming communities. Feral vertebrate pests such as wild boar and deer, apes such as monkey and marsupial like porcupine are major problem. It is estimated that 126 kgs of crops per household are lost annually to wild animals pests. Other crop diseases such as Gray Leaf Spot and Turcicum Leaf Blight in maize, Greening in Citrus, phythoptra diseases in chilli and potatoes also continue to pose major challenges.
 
Domestic cattle and equine population left stray in winter is one of leading factor discouraging farmers from growing winter and spring crops such as wheat, barley and buckwheat affecting the cropping intensity and overall production potential.

Labor shortage including increasing feminization of the agricultural labour force is becoming one of the leading constraints in agriculture production. According to agriculture statistics 2011, available farm labour constitutes only 26 percent. Rural female population is more by 3.7 percent overall. In the age group of 15-64 which is also an active population group, female population is higher by 7.5 percent, and this is likely to increase. This gender imbalance in agriculture workforce will also have significant impact on agriculture.

These factors have contributed to RNR sector providing the least monthly earnings among all major occupations. If this trend continues, it is likely that more and more people could leave their farms which could adversely impact the goals of achieving food and nutrition security, reducing unemployment levels and, may likely reverse the gains achieved in poverty reduction.

5.5.3  Sector Key Result Areas

5.5.4  Strategies

A key strategy will be to transform the RNR sector into a commercially viable sector that provides higher returns to the farmers, improves rural livelihood, reduces imports and promotes exports, and offers attractive employment opportunities to youth. To facilitate this transformation, focused initiatives will be undertaken as follows:

Targeted and commodity focused approach: One Gewog One Product, based on commercial viability of such product and the potential of different Gewogs, will be one of the strategies to achieve the objective of food and nutrition security. At national level, the focus will be on fewer prioritized products that will enhance food self sufficiency and also contribute to import substitution and export promotion. The Dzongkhags identified to produce prioritized products will be provided necessary support, both technical and resources, by the Ministry of Agriculture and Forests through central RNR programmes.

Transition from subsistence to commercial agriculture: Investment in the RNR sector will be aimed at ensuring gradual transition from subsistence to commercial production. This would require introduction and application of technologies that improves productivity of crop, forest and livestock. To provide both economies of scale and fair terms of trade, the evolving farmers' organizations and cooperatives will be supported technically and financially, notably through preferential access to loans from financial institutions, extension support services and other forms of support.

Enabling environment: A policy and legal framework that incentivizes RNR production and promotes private sector investment will be implemented. Access to finance will be facilitated through priority lending by financial institution to the RNR sector. Infrastructure facilities such as irrigation, storage and communication to facilitate efficient and effective production, marketing and distribution of RNR products will be prioritized. Linkages between research and extension services will be strengthened and streamlined to improve the productivity of farming systems.

Promote private sector participation and contract farming: Government will facilitate an enabling environment for private sector participation and contract farming to enhance market access, innovations and technical expertise. Private sector participation will be encouraged in the entire value-chain, starting from agriculture input supply to production, processing, distribution and marketing.

A reliable institutional mechanism will be established to effectively cater to the needs of the interested private entities. Wherever applicable, best practices gained from the Hazel nut and Coffee plantation ventures will be used to attract private investment in the RNR sector.

5.5.5  Key programmes

Some of the major programmes are as follows:

•	National field crops development
•	Agriculture infrastructure development

•	National Organic

•	National horticulture development

•	National livestock development

•	Market development

•	RNR Research and extension services

•	National bio-security and food safety

Programme details are presented in Eleventh Plan Volume II document."
5,5.6,"Tourism Sector

Tourism in Bhutan is governed by the policy of ""high value-low impact"" tourism. The policy serves to develop tourism that has minimum negative impact on our natural and cultural heritage. The tourism pricing of USD $200 per person per night during off-seasons and USD $250 per person per night during seasons forms the basis for regulating tourist arrivals. Travel to Bhutan is booked either through Bhutanese tour operator or their international partners.

Culture and nature are the two leading purposes for tourist arrivals. The majority of arrivals are in spring (February-April) and autumn (August-October) season.

The tourism sector is the major source of foreign exchange earnings and employment. Gross earnings in 2012 were USD 62.80 million and approximately 22,045 employment opportunities were created in 2011. Out of USD 62.80 million, USD 16.63 million was generated as direct revenue for the Government through the ""Royalty"" (35 percent tourism levy on daily tariff). Other taxes such as the Business Income Tax (BIT) and Sales Taxes paid by tourism service providers also translate into government revenue, therefore increasing revenue generated by the tourism industry.

5.6.1  Current Situation

With improvements in tourism infrastructure facilities and better air connectivity, the number of tourist arrivals to Bhutan has increased from about 6,000 in 2001 to about 105,407 in 2012. The figure includes 54,685 international visitors and 50,722 regional visitors. The average length of stay was 6.90 days.

The arrival figures include about 57 percent international visitors, 26 percent regional high-end visitors, 16 percent MICE (Meeting, Incentive, Conferences, Exhibition) visitors, and 1 percent familiarization visitors. The highest number of visitors was from Japan at 15.98 percent, followed by USA at 13.67 percent and China at 8.57 percent. Among the regional tourist, arrivals from India topped the list with 87 percent, followed by Bangladesh at 11 percent and Maldives at 2 percent.

In terms of the tourism spread, Paro Dzongkhag hosted the maximum bed nights (32.69 percent) followed by Thimphu, Wangduephodrang, Punakha and Bumthang. Pemagatshel, Zhemgang, Tsirang, Dagana, Sarpang and Samtse were among the Dzongkhags that hosted less than 0.04 percent bed nights. This is due to lack of tourism products in these Dzongkhags. However this is likely to change in the coming years with the Royal Manas National Park being open to tourism. The tourist arrivals in Trashigang and Samdrup Jongkhar have improved significantly as a result of opening of Merak Sakteng trek and also use of Samdrup Jongkhar as an entry point from the south-east.

The tourism package covers the cost of accommodation in a '3-Star' and above category hotel, local guide and transportation, and three meals. Currently, there are 123 accommodation providers with a capacity of 2,749 rooms offering 5,464 bed nights consisting of 8 '5-Star', 7 '4-Star', 40 '3-Star', 54 '2-Star' and 19 '1-Star' category. Accommodation classified as '2-Star' and below have been encouraged to upgrade to '3-Star' and above in order to cater to tourist. The annual occupancy rates was highest in the '3-Star' category with 34.46 percent followed by '5-Star'.

In terms of tour operators, there were 741 registered local tour operators, of which 318 were operational. The top 12 tour operators accounted for 41.46 percent of total arrivals with the highest number of tourists managed by a single operator of 4,159 visitors.

5.6.2  Key Challenges

It is evident from the above that the tourism sector has made much progress and is one of the key economic sectors contributing to economic growth, employment and revenues. However, constraints in terms of accessibility, regional spread, seasonality and product diversification are still issues of concern.

With just one international airport at Paro and with only Druk Air, the national carrier with a fleet of three Airbus A319 and one ATR 42-500, flying to limited destinations in the region, traveling to Bhutan is a challenge to many visitors. The number of visitors to Bhutan currently is determined by Druk Air's capacity. In 2012, about 88 percent of the visitors used air as preferred mode of travel to Bhutan. Since October 2013, a private airline, Bhutan Airlines owned by of Tashi Air Private Limited, started operating between Paro and Bangkok sector with one Airbus 320.

The other major challenge faced is the shortage of manpower in the form of trained guides, skilled workers in hospitality sector, qualified and experienced professionals in product development, destination marketing and other tourism-related services. The sector is still largely dependent on international tour operators for arrivals.

Among the 20 Dzongkhags, Paro, Thimphu, Punakha, Wangduephodrang and Bumthang are the major beneficiaries of tourism. Lack of tourist infrastructure facilities/amenities, travel time and limited tourism products are some of the reasons for other Dzongkhags not benefitting much from the sector. However, with the completion of three domestic airports and efforts already underway to create infrastructure facilities and products in Central, South and East, the lack of regional spread is expected to be addressed in the next few years.

5.6.3  Sector Key Result Areas

5.6.4  Strategies

Tourism will be one of the priority sectors under Rapid Investments in Selected Enterprises (RISE) programme. Under the programme, selected initiatives that contribute to achieving higher yields per tourist as well as double the arrivals but spread throughout the country and throughout the calendar year will be defined and implementation of these initiatives closely monitored.

5.6.5  Key Programmes.

•	Sustainable Tourism Development: The focus of this programme will include product diversification to ensure regional and seasonal spread, improving quality and standards of services including accommodation and tourism attractions, exploring new markets, and decentralization of tourism planning and development. Further, the programme will ensure that local communities are able to reap the benefits from this industry. The thrust area for this industry will continue to be high end sustainable tourism destination.

•	Strengthening of Royal Institute of Tourism and Hospitality: The Institute is expected to enhance the quality of tourism and hospitality professionals by benchmarking its training programmes to international standards and working towards its vision of becoming a regional center of excellence. The training modules and curriculum will be reviewed and improved based on periodic training needs assessments. Required additional infrastructures will be put in place and capacity development of faculties will receive priority.

Programme details are presented in Eleventh Plan Volume II document."
