,sector,text
10,5.11," Roads & Bridges Sector

For a landlocked country, a good network of road and bridges play a critical role in facilitating trade, transit, reducing the high cost of transportation normally associated with mountainous countries and for delivery of socio-economic services particularly to scattered and far-off rural communities.

Recognizing the importance of the roads and bridges sector, Bhutan started its first Five Year Plan in 1961 with the construction of the first national highway - Phuentsholing-Thimphu highway. Since then the network of roads and bridges have expanded significantly and today all twenty Dzongkhags are connected by road.

The Department of Roads is the national authority responsible for all roads in the country. For roads in a Thromde, the Thromde Administration is responsible for the administration and management of all roads, constructed or maintained by it, including any access roads. Similarly, for roads in the Dzongkhag and Gewog, the Dzongkhag administration is responsible for the administration and management of all roads constructed or maintained by it, including access roads. For farm roads technical specification, guidelines and manuals are provided by the Ministry of Agriculture and Forest.

The strategic framework for the construction, expansion and maintenance of road infrastructure up to the year 2027 is guided by the Road Sector Master Plan (RSMP).

The main thrust of the roads and bridges sector in the Eleventh Plan will be to complete the national highway grid using environment friendly technology, construction and upgradation of roads connecting to hydro-power projects and to enhance the safety, reliability and quality of roads.

5.11.1 Current Situation

Bhutan's road transportation network is classified into five categories as follows:

•	National Highways - consisting of Asian Highway/International Road (currently Phuentsholing-Thimphu Highway), Primary National Highway (existing East-West Highway and North-South highways) and Secondary National Highway (currently District Roads);

•	Dzongkhag Roads (currently feeder Roads);

•	Farm Roads (currently Farm Roads and Power Tiller Roads);

•	Thromde Roads (currently Urban Roads); and

•	Access Roads.

Currently, Bhutan has 10,578.26 kilometers of various categories of roads, 337 numbers of bridges totaling 10,604.5 meters and 380 pedestrian bridges nationwide.

5.11.2 Key Challenges

Most of the existing primary and secondary national highways, including the Northern East-West highway, were constructed in the 1960s and 1970s when the traffic volume was low with the primary objective of providing connectivity to settlements. With increase in traffic volume, road safety has become a growing challenge.

Additionally, financial sustainability in terms of improving the specification of the existing roads, maintenance costs and blacktopping cost of unpaved roads is another challenge. To improve access particularly in rural areas, extensive network of Gewog Connectivity roads have been constructed and many of these roads are unpaved. A preliminary assessment of blacktopping about 2,000 kilometers of Gewog Connectivity roads would cost about Nu. 13 billion. The ADB's Country Diagnostic Study 2012 estimates that while the density of road has doubled from about 1.5 km/km² in 2005 to 3 km/km² in 2011, the percentage of paved roads have decreased from about 55 percent to about 35 percent during the same period.

5.11.3 Sector Key Result Areas

5.11.4 Strategies

Institutional and human resource development will be one key strategy to strengthen the capacity of road sector to plan, design, build and maintain road network. To reduce travel time and costs and to enhance road safety, road specifications and standards will be improved and geometric improvements and regular maintenance of road will be carried out. The government will also explore possibilities of tunneling certain stretches of the highways through PPP wherever feasible. The involvement of the private sector in the maintenance of roads will also be explored in order to ensure financial sustainability.

5.11.5 Key Programmes		
•	Construction  and  Upgradation  of  Southern  East-West  Highway:  The construction and upgradation of the Southern East West Highway (SEWH) from Sipsu to Jomotsangkha will be a priority. In the Eleventh Plan the remaining links between Gelephu - Panbang; Sarpang - Lhamoizingkha; Deothang - Nganglam; and Samrang - Jomotsangkha will be constructed.	PLAN
•	Upgradation/Improvement of Northern East -West Highway: The northern East-West highway from Thimphu to Trashigang will be upgraded and improved.

•	Construction/Upgradation of North South Highways: The ongoing North-South highways including Gyalposhing - Nganglam, Gomphu - Panbang, Gesarling - Lhamoizingkha and Damchu - Chukha bypass Road will be completed. On completion of these roads, there will be 7 North-South highways helping to strengthen the road network and facilitate easy movement of goods and services to the Southern borders.

•	Construction and Upgradation/Improvement of roads connecting hydro power projects: The construction of Mandelpong-Digala, Riphay - Koshala and Tingtibi-Praling will be completed. The upgradation of Chazam - Tashiyangtse will be also carried out for the Kholongchu HPP.

•	Construction of Dzongkhag roads: The construction of ongoing Dzongkhag roads Tsebar-Mikuri-Durungri road connecting Gyalposhing-Nganglam Highway will be completed in the Eleventh Plan.

Programme details are presented in Eleventh Plan Volume II document."
11,5.12," Construction Sector

The construction sector plays a vital role in the delivery of quality infrastructure which is essential for our socio-economic development. It is also a key sector in terms of its contribution to economic growth and employment. The key agencies responsible for the development of construction sector are:

Department of Engineering Services (DES): DES was created in 2011 by bifurcating the erstwhile Department of Urban Development and Engineering Services (DUDES) into Department of Engineering Services (DES) and Department of Human Settlement (DHS). DES is responsible for promoting construction technology, providing technical backstopping to the other ministries, Dzongkhag Administrations and Thromdes and supporting professional development of all the engineers.

Construction Development Board (CDB): CDB is a bridge between the government and the construction industry and is responsible for facilitating development of a vibrant construction industry. Its core functions include registration, classification and monitoring of contractors, consultants and engineers/architects.

Construction Development Corporation Limited (CDCL): CDCL was established on 1st July 2006 as a public sector company owned by the Royal Government of Bhutan with the following objectives:

•	Enhance efficiency, mechanization, improve standards and create a good benchmark of quality infrastructure in the construction sector.

•	Lead the modernization of the construction industry through the introduction of appropriate machineries and technologies, including the maintenance of an equipment bank of machines not easily available in the market to support the government and the private sector.

•	Participate in the booming construction industry, introducing technology intensive construction and building capacity of local construction industry through collaborations.

•	Generate employment and at the same time develop necessary skills for skilled and unskilled national manpower, thereby gradually reducing dependence on the expatriate work force.

The private sector is represented by the Construction Association of Bhutan under the Bhutan Chamber of Commerce and Industries (BCCI). Its membership includes all firms under the construction industry.

The sector has come a long way with establishment of various agencies and introduction of many new initiatives towards making the sector more efficient and effective. However, poor quality of construction, human resource constraints and high construction costs continue to affect the sector. The main thrust in the Eleventh Plan will, therefore, be on enhancing the quality of construction through efficient and appropriate technology, mechanization and human resource development.

5.12.1 Current Situation

The construction sector contributed about 16 percent of nominal GDP and recorded an annual growth of 35 percent in 2011. The sector's contribution is expected to increase in the coming years with accelerated development of hydro-power projects. In terms of employment less than 5,00049 Bhutanese were employed by the construction sector in 2012.

The contractor classification was re-categorized to increase flexibility and to allow contractors to participate in larger contract. Currently there are about 3,892 registered contractors, of which 120 are large (above Nu. 15 million), 380 medium (Nu. 4-15 million) and 3,392 small (under Nu. 4 million) contractors. About 127 Bhutanese contractors, in various categories, are engaged in the construction of three ongoing hydropower projects. Besides construction companies, there are about 63 architects and 46 construction related consultants in Bhutan.

5.12.2 Key Challenges

Construction sector perceived poorly for employment: With three new hydropower projects under construction and seven new projects planned to be started in the Eleventh Plan, there are ample opportunities for addressing unemployment. However, construction sector jobs are perceived as inferior by many Bhutanese and as a result foreign workers51 are brought in to fill the gap. Some of the reasons for this perception are low wages, lack of job security (workers have to find a new job once the construction project is completed), low level of mechanization and the manual nature of work.

Limited capacity and poor quality: The shortage of engineers, architect and other qualified professionals combined with a lack of basic tools and technology for effective planning, designing and supervision results in frequent changes in the scope of work and consequently the cost of construction projects. It is estimated that Bhutanese construction projects are 15-20 percent more costly and take 50 percent longer to complete compared to similar construction work by Indian contractors on similar projects. 90 percent of all construction projects in Bhutan have time and cost overruns as compared to 40 percent in India and 5 percent in best-in-class countries52. Further, due to poor quality of construction, the cost of maintenance is expected to be double the industry standard.

5.12.3 Sector Key Result Areas

5.12.4 Strategies

Training and capacity building of engineers, architects and other professionals in the construction sector will receive high priority in the Eleventh Plan's Human Resource Development Master-plan.

Mechanization of construction sector, use of local construction materials, centrally fixed rate contracts for some key materials (like cement, steel, bitumen etc.) will be pursued in order to avail institutional-buyer-discounts to reduce the cost of construction.

To encourage youth to work in the construction sector special service conditions such as job security and better wages will be explored. Vocational training programmes will be aligned to the needs of construction industry and will include apprenticeships and on-the-job trainings. Vocational training graduates will be encouraged to form their own construction firms and the government will provide necessary support for start-ups.

5.12.5 Key programmes

•	Promotion and Strengthening of Construction Sector: The Construction Development Board (CDB) will concentrate on promoting efficient and quality based construction sector. These will be carried out through awareness programs among the contractors and mechanization. The benefits of creating an autonomous Construction Development Authority (CDA) to be able to discharge its roles and responsibilities efficiently will be explored.

•	Engineering Adaptation and Disaster Risk Reduction: The major activities to be undertaken during the plan period are construction of flood protection walls and land reclamation along major flooding rivers, disaster risk assessment and mapping and development of guidelines and manuals. Flood risk assessment and vulnerability mapping will also be carried out. These are aimed to reduce the vulnerability of people and places to floods.

•	Technical support and management for infrastructure development and engineering services: The Department of Engineering Services will provide technical backstopping to all government agencies and Thromdes. It will promote the construction of MICE facilities through PPP. The construction of water reservoirs in water stressed towns will also be initiated. The development of regional hubs and centers in eastern Bhutan to promote regional balanced development will be carried out.

•	Technical support for construction and maintenance of suspension bridges and mule tracks: There are still many communities who need trail suspension bridges as a principle means of transport. The Department of Engineering Services (DES) will also initiate the construction of bazams and maintenance and technical backstopping for the construction of trail suspension bridges.

Programme details are presented in Eleventh Plan Volume II document."
12,5.13," Human Settlement & Housing Sector

Human Settlement: Until recently, the focus of this sector was mainly on urban development to meet the needs arising from the rising trends in rural-urban migration and rapid pace of urbanization, particularly in the two major towns of Thimphu and Phuentsholing. The Bhutan National Urbanization Strategy 2008 estimates that the average annual growth of urban population in Bhutan during 2000-2005 was 7.3 percent, with Thimphu city experiencing the highest growth at 12.6 percent. This rapid growth in urban population has created severe pressure on existing facilities leading to problems of water shortages, lack of sanitation and waste disposal facilities etc. To address these problems, a number of urban development programmes, particularly in Thimphu and Phuentsholing, have been implemented over the last decade. However, in spite of major infrastructure expansion, the rural-urban migration trend continues and urban centres continue to face difficulties in provision of urban services. Further, expansion of the existing services is also constrained by limited land availability in urban areas. In the meantime, large scale unplanned developments near urban areas are taking place.

In order to address the issues of rapid urbanization and unplanned development a new Department of Human Settlement (DHS) was created by bifurcating the erstwhile Department of Urban Development and Engineering Services into two separate departments in 2011. The Department of Human Settlement is responsible for preparation of human settlement policies, strategies and plans.

The main thrust of the human settlement sector will be to develop strategic human settlements with a focus on balanced regional development and improving the quality of life and socio economic status of both urban and rural residents.

Housing: The National Housing Development Corporation Limited (NHDCL) was established on 15 July 2003 to promote and develop housing in Bhutan in line with the National Housing Policy 2002. It was corporatized in 2009.

The main thrust of housing sector in the Eleventh Plan will be to provide safe, adequate and affordable housing to all and promote homeownership. Where feasible, participation of the private sector will be encouraged.

5.13.1 Current Situation

Human Settlement: - Till recently, priority was accorded to planning and development of urban centres and not on human settlements. However, the emergence of unplanned settlements near the urban areas is constraining urban expansions and provision of service facilities. Therefore, DHS was mandated to develop settlement plans that take into consideration the planning of an entire region.

As of now, comprehensive human settlement plans do not exist, other than structural and local area plans for settlements classified as i) Class A Thromdes - Thimphu, Phuentsholing, Gelephu and Samdrup Jongkhar; ii) Class B Thromdes - Dzongkhag centre; and iii) Yenlag Throm. The criteria for various categories of towns are as follows:

Class A Thromdes should have a resident population of more than 10,000 with population density of 1,000 persons or more per square kilometers. The area should not be less than 5 square kilometers and should have revenue base sufficient to finance the establishment and maintenance of infrastructure and provision of services. It should have a national administrative significance such as being the capital city or a town that services more than one Dzongkhag.

Class B Thomdes should have a resident population of more than 5000 with population density of 300 persons or more per square kilometers. The area should not be less than 1 square kilometer. It should have significant commercial, industrial or institutional centre and at least 50 percent of the population dependent on non-primary activities.

Yenlag Throm should have a resident population of more than 1500 and area not less than 50 acres.

In 2010, the Parliament approved four Class A Thromdes and 18 Class B Thromdes. Yenlag Throms are yet to be approved.

Housing: The sector is guided by the Housing Policy 2002. Currently, there are 1,122 housing units across the country for rental and 32 apartments in Changjiji allotted under homeownership programme to low income groups.

BLSS 2012 reports that 85 percent of the households in the rural areas lived in houses whereas almost three-fourths of urban households (73 percent) lived either in part of a house or in an apartment. It also indicates that about 60 percent of the household owned their own dwellings, out of which 83 percent households were in rural areas and 17 percent in urban areas. 62 percent of households in urban areas rented their dwellings. The private sector is the largest provider of dwellings for rent, especially in the urban areas, where its rentals comprise 43 percent of dwellings. About one-fifth of urban dwellings are owned by the government and public corporations.

Among the Dzongkhags, Pemagatshel had the highest proportion of households that own their dwellings (91 percent) and Thimphu the lowest with 19 percent. The proportion of households that own their dwellings is below 60 percent in only three other Dzongkhags: Chhukha (43 percent), Sarpang (52 percent), and Paro (58 percent). In Thimphu, three-fifths of households rent and one-fifth live in rent-free dwellings; 80 percent of the rent-paying households live in dwellings owned by private individuals; and 18 percent live in housing owned by the government and public corporations.

Households in the poorest per capita consumption quintile paid a house rent of Nu 1,217 a month, on average, while the richest households pay about Nu 4,487. The average monthly rental is highest in Thimphu and Wangduephodrang (about Nu 5,000) and lowest (about Nu. 900) in Gasa and Lhuentse.

5.13.2 Key Challenges

Human Settlement - In absence of a clear legislation such as the National Spatial Planning Act and the National Human Settlement Policy it is difficult to plan, coordinate and implement human settlement strategy.

The sector also faces acute shortage of human resources. While the department has urban planners, urban designers, architects, infrastructure planner and engineers, the numbers are not adequate. Moreover, lack of qualified and experienced GIS professionals, municipal engineers, urban economists, sociologists, planning lawyers, investment planners and environmentalists limit the sector to address complex urban issues.

Further, other issues such as timely availability of land, resources to implement structural and local area plans and resistance to introduction of new/revision of taxes, hamper strategic human settlement development.

Housing - National Housing Development Corporation was established in 2003 to implement the National Housing Policy 2002 objective of providing safe and affordable housing for all. A decade after its establishment not much progress has been made considering the present housing stock of 1,122 units which includes units/bungalows constructed in 1970s and 1980s. Places like Thimphu, Phuentsholing, Gasa, Lhuentse and Samdrup Jongkhar have severe housing shortages. As a result, many Bhutanese in Phuentsholing are forced to live across the border and in places like Gasa and Lhuentshe civil servants are living in temporary makeshift houses due to lack of proper housing.

The challenge is not only in terms of increasing the housing stock but also making it affordable particularly for the low and middle income group. The high cost of financing and raw materials makes construction expensive resulting in higher rents. NHDC's assessment indicate that low income people spend about 50-60 percent of their income on house rent in Thimphu and Phuentsholing against an ideal proportion of 30 percent of income.

5.13.3 Sector Key Result Areas

5.13.4 Strategies

Human Settlement - To ensure sustainable development of human settlements, new legislation and policies will be formulated and existing rules and regulations reviewed and improved. Development of valley plans, regional hub plans and rural urban development plans will be accelerated in order to contain the rural urban migration. Capacity strengthening of engineers, architects and planners will be given emphasis.

Housing: NHDC will explore new technologies and design innovation to reduce the cost of construction while ensuring high quality. Over the next five years, about 800 new units of low income housing for rental will be constructed across the country. To promote homeownership, about 100 units will be constructed which will be allotted to low income civil servants based on modalities such as direct purchase, lease, and purchase and installment payment basis depending on the purchasing capacity of the beneficiaries. Given the limited resources of the government, partnership with private sector for the provision of low-cost housing will also be explored.

5.13.5 Key Programmes

•	Enhancing human settlement in Bhutan: The development of settlement has been accorded high priority in past plans but the efforts were mostly concentrated in urban areas. With the creation of the Department of Human Settlement (DHS), focus will be accorded equally to both urban and rural settlements. The major activities in the Eleventh Plan are development of valley development plans, urban development plans and rural development plans. The environment and disaster resilient aspects will be incorporated while developing the structural and local area plans.

•	Promotion of affordable housing and home ownership: The NHDC will construct affordable housing particularly in Dzongkhags/towns like Thimphu, Phuentsholing, Samdrup Jongkhar, Lhuentse and Gasa where housing shortage is a major problem.

Programme details are presented in Eleventh Plan Volume II document."
