,sector,text
7,5.8,"Hydropower, Renewable Energy and Hydromet Sector

The energy sector is the lynchpin of our economy and accounts for about 18 percent of total revenues and about 20 percent of GDP. Bhutan has an estimated hydropower potential of 23,760 MW with a mean annual energy production capability close to 100,000 GWh. At present, the installed hydropower capacity is 1,488 MW, about 5 percent of the total potential.

The main thrust area for the Energy sector in the Eleventh Plan is ""Energy Security for Sustainable Development"".

5.8.1  Current Situation

Currently, construction of 1,020 MW Punatsangchhu I Hydroelectric Project, 1,000 MW Punatsangchhu II and 720 MW Mangdechhu Hydroelectric Projects are ongoing. All three projects are scheduled to be completed by 2017-18.

The other projects, to achieve 10,000 MW hydroelectricity generations by 2020, are planned to start construction during the current Plan period. The construction period ranges from 8-9 years.

To ensure electricity for all and for inclusive growth, the government has actively pursued rural electrification since the Sixth Plan (1988-1993). Till date 82,270 households have been electrified out of the total of 88,642 households in the country resulting in overall electrification coverage of 92.82 percent.

Besides mega hydroelectricity plants, the installed capacity from renewable energy technologies is about 8,152 kW (solar PV contributing 152 kW and from small hydro projects 8,000 kW). Further, about 900 biogas plants and 10 solar heating systems were promoted as part of the programme to promote alternate renewable energy.

The domestic electricity tariff was revised recently in October 2013 and in spite of about 15-20 percent increase for different categories of consumers, it is still the lowest in the region. For example45, in the neighbouring Indian state of West Bengal, the lifeline block, meant for rural households, has a cap of 75 units, with a tariff of Rs 3.19 a unit. In the bordering state of Assam, the lifeline block is capped at 30 units and the tariff is Rs 2.75 a unit. The cap for low voltage (LV) users in West Bengal is 350 units, with tariff averaging at Rs 5.69 a unit. For the same category, the tariff is Rs 4.59 a unit in Assam. When it comes to medium voltage (MV) consumers, the tariff is Rs 6.97 a unit in West Bengal, and Rs 3.25 a unit in Assam. High voltage (HV) consumers or factories in West Bengal pay Rs 6.13 a unit, while in Assam it is Rs 4.18 a unit

A new element in the revised electricity tariff is that rural consumers are provided free electricity for first 100 units for the next three years. This was done to encourage the rural community to use electricity to cut down use of firewood for environmental and health reasons.

5.8.2  Key Challenges

The high upfront investment costs required for developing hydro-power projects pose significant challenge in terms of raising financing for the project. The Government of India has agreed to provide the required financing and also buy any surplus power through the Umbrella Agreement on Development of Hydropower Projects signed between the two governments in 2006 and a Protocol to the 2006 agreement signed in 2009. The pace of hydropower project development will however depend on the availability of financing.

The extensive rural electrification programme to supply electricity to all households through grid and non-grid supply carried out since the Sixth Plan has resulted in substantial increase in number of domestic consumers and the demand for electricity. Maintaining the balance between the needs of domestic consumption and export earnings, meeting the demand by households and industries, and the cost of electricity supply and viability of tariff levels will be a challenge till new hydropower projects are commissioned.

Other challenges that need to be addressed include infrastructure development, system reinforcement and human resource capacity.

Glacial Lake Outburst Floods (GLOF) - Bhutan is home to 677 glaciers and 2,674 glacial lakes (Second National Communication, 2011). A recent study by Japan International Cooperation Agency (JICA) revealed that there are 2 potentially dangerous lakes, Thorthormi and Raphstreng, contrary to the figure of 25 lakes reported by International Center for Integrated Mountain Development (ICMOD) in 2001.

The report indicates that the two lakes are about 30 meters apart separated by a shrinking moraine dam. If the barrier is broken the water body from Thorthormi would flow into Raphstreng creating the threat of a possible outburst flood. The combined volume of water from these two lakes are projected to produce about 53 million cubic metres which would cause a flood three times more powerful than the 1994 flood in Punakha from Luggye lake. However, the risk has been reduced substantially after the mitigation works undertaken in the Tenth Plan.

5.8.3  Sector Key Result Areas

5.8.4  Strategies

Enhancing institutional and human capacity will be a critical strategy. The energy sector's capacity to design, build, operate and manage hydropower projects will be developed through human resource development. Since hydro-meteorological services play an important role in development of hydroelectric projects, capacity to collect, analyses and interpret hydro-meteorological data will be strengthened. Other issues such as the benefits of separating transmission and distribution utilities and feasibility of establishing a Power Trading Company will be explored.

Development of sustainable energy allocation policy - With the commissioning of new hydropower projects in the next few years, Bhutan's firm power will be enhanced substantially. To prepare for the optimum utilization of firm power that would be available and to plan for clean green industrial development, energy allocation policy will be formulated.

Development of Renewable Energy - To enhance energy security and reduce dependency on fossil fuel, other forms of alternate renewable energy will be promoted. Renewable energy (RE) master-plan will be developed to map RE potential and sites and feasibility studies will be conducted.

5.8.5  Key Programmes

•	Accelerated Hydropower Generation & Transmission Network Strengthening - Major activities include new system infrastructures and system reinforcements to ensure reliability and security of domestic power supply; pre-feasibility studies and reconnaissance studies for new hydropower projects, implementation of pre-construction activities and construction of hydropower projects; establishment of a Power Training Institute to address manpower deployment in Hydropower projects; and construction of new transmission lines and associated substations by BPC.

•	Enhancing Hydrological Network for Water Resources Assessment and Improvement of Flood Information/GLOF Early Warning System - Strengthening of hydrological information and establishing early warning networks and stations to reduce the risks of climate change induced disasters like floods, landslide, and droughts will be the focus.

•	Strengthening Meteorological Network Coverage and Enhancing Weather and Climate Information Services - The current observation network in
 
Bhutan is inadequate in terms of spatial coverage and representativeness. Hence, strengthening meteorological network coverage and enhancing weather and climate information services will be the focus.

•	Promotion and Development of Renewable/Alternate Energy Technologies - The Programme aims to diversify energy supply mix using other renewable energy resources like solar, wind, biomass, small hydro and other emerging modern fuels for energy generation and to strengthen the institutional capacity for provision of efficient and responsive energy services in the Country. The Program intends to develop Renewable Energy Master Plan, conduct pre-feasibility and feasibility studies to attract the investors in the RE Sector. The Programme will promote biogas plants as alternate source of fuel for cooking, Compact Fluorescent Lamp (CFL) instead of incandescent lamps in the LV category consumers, energy efficient wood stoves to reduce fuel-wood demand and solar water heating systems as alternative means for heating water and space.

Programme details are presented in Eleventh Plan Volume II document."
8,5.9,"Information, Communication & Technology and Media Sector

Information, Communication & Technology and Media play an important role in developing a more open, just and democratic societies. It is a key element for empowering people and enhancing transparency, accountability and good governance. The right to information as enshrined under Article 7(3) of the Constitution is a fundamental right of every Bhutanese citizen. Accordingly, the Right to Information Bill was tabled in the first session of the second Parliament in September 2013 and will be further deliberated during the next session.

ICT and Media are also critical ""to promote a green and self reliant economy sustained by an IT enabled knowledge society guided by the philosophy of GNH"" as underlined in the Economic Development Policy 2010 (EDP). The sector has been identified as one of the sectors for provision of high end green services such as Business Process Outsourcing (BPOs), Knowledge Process Outsourcing (KPOs), Data Centres and other IT enabled services in health, education, finance etc.

Given the importance of the sector, a number of initiatives have been implemented to strengthen the ICT backbone infrastructure, develop appropriate policy and legislation and enhance the technical capacity of ICT professionals. Further, an E-Gov Master Plan that has been developed to provide the strategic direction for development of the sector will be implemented during the Eleventh Plan.

The main thrust in the Eleventh Plan will be to make the sector ""affordable, reliable and sustainable"" through implementation of the E-Gov Master Plan. The objective of the E-gov Master Plan is to consolidate and optimize the investments in various IT infrastructures during the Tenth Plan period for improved service delivery, enhanced access to services and information and facilitating good governance. The focus will be on consolidating the E-gov projects such as the G2C, establishing a government data centre, and further improving the nationwide intranet system - Thimphu Wide Area Network (TWAN) & Dzongkhag Local Area Network (DLANs) for smooth and seamless functioning of many of our online services. Special attention will be paid to tapping the potential of mobile technology for delivering services including for financial payments.

5.9.1  Current Situation

Since the launch of television and internet on 2 June 1999 and cellular mobile on 11 November 2003, ICT and media sector has made significant progress. The key indicators of the ICT and Media sector are as follows:

Policy: Bhutan Information, Communication and Media Act (BICMA) 2006 provide the overall legal framework for the development of ICT and media sector. The Act is being revised to incorporate provisions on cyber security, data protection, privacy, broadcasting etc. Further, the e-Gov Master Plan, Telecom & Broadband Policy, Media Policy, Film Policy and Advertisement Policy have been drafted and will be submitted to the government for approval in the Eleventh Plan.

Infrastructure: Under the National Broadband Master plan project, optical fibers have currently reached all 20 Dzongkhags and 174 Gewogs. Except for four, the remaining Gewogs, will be connected by December 2013. The Second International Gateway has been established at Gelephu and operationalized to create the required redundancy. Direct high bandwidth connectivity to India, Nepal and Bangladesh is being established under SASEC Information Highway Project. More than 90 Government organizations are connected through the Thimphu Wide Area Network (TWAN). Of the 182 Community Centres (CCs) that have been established, Telecommunications - All 205 Gewogs have access to mobile services and the remaining 10 villages will be connected by mobile services by the end of 2013. B-Mobile, a subsidiary of Bhutan Telecom Limited (BTL), and Tashi-Cell, a subsidiary of Tashi InfoComm Limited (TICL), are currently the two service providers offering mobile services with BTL being the sole provider of fixed-line telecommunication in the country. Internet services are provided by Druknet (under BTL), TICL, Samden Tech and Drukcom.

e-Service Delivery - In the area of e-Services, a Government-to-Citizen (G2C) initiative is underway to implement 136 e-Services. 22 G2C e-services have been made available through the CCs that are connected with internet.

5.9.2  Key Challenges

Telecom tariff - Telecommunication tariff will be an important consideration for investors to set-up BPOs, KPOs, Data Centre and IT enabled services. Currently, telecommunication tariffs in Bhutan are much higher than those in India with differences ranging from 114 percent for 1 mbps to 315 percent for 8 mbps. The high difference in tariff levels could negate Bhutan's comparative advantage of political stability, clean environment and availability of cheap and reliable power. The tariff structure will be reviewed to make it more competitive and affordable.

International redundancy: International redundancy is defined as direct telecom infrastructural links with multiple countries. At present, all telecom links to the outside world are routed through Siliguri, India. Any operational failure in the telecom link through Siliguri could lead to connectivity problems. An alternate telecom link with the outside world is necessary for international redundancy without which it may be difficult to position Bhutan as a potential hub for ICT and ICT enabled services. An alternate link through Cox's Bazaar, Bangladesh will be explored.

Talent Pool - the strength of the ICT sector is primarily determined by availability of a rich pool of competent information and communications professionals. Currently, Bhutan has about 350 ICT professionals within the civil service. However, the sector still lacks qualified professionals particularly in specialized ICT skills such as network security, cyber laws, software development and programming. Creating a talent pool and strengthening ICT human resource management through parenting, clear career advancement opportunities and effective deployment and utilization of ICT personnel will be a priority.

5.9.3  Sector Key Result Areas

5.9.4  Strategies

While implementation of e-Gov Master Plan, capacity building and ICT infrastructure expansion will be the main strategy for ICT sector, the following will be pursued to address the issues and challenges confronting the ICT sector:

•	Review of telecommunication tariff to ensure affordability and competitiveness.

•	Improve international redundancy by exploring alternate link through Cox Bazar, Bangladesh.

•	Create talent pool and strengthen ICT human resource management through parenting, clear career advancement opportunities and effective deployment and utilization of ICT personnel.

5.9.5  Key Programmes

•	ICT for good governance and socio economic development - the focus will be on consolidating the e-governance projects, digital migration, establishing a whole of government data centre, and further improving the nationwide intranet system (TWAN & DLANs) for smooth and seamless functioning of many of our e-government services.

•	Promotion and Development of Media - the main focus will be introducing media and information literacy curriculum in schools, and promotion of contemporary arts, creative media and films and strengthening policy and legal instruments.

Programme details are presented in Eleventh Plan Volume II document."
9,5.10," Transport Sector

Transport sector covers surface and air transport. The surface transport is regulated by the Road Safety & Transport Act 1999 and air transport by theCivil Aviation Act 2000.

The main thrust of the transport sector in the Eleventh Plan will be to ensure safe, efficient and reliable transport services.

The focus of surface transport activities will be the implementation of the Bhutan Transport Strategies 2040. The primary objective of Bhutan Transport Strategy is to address the issue of growing traffic congestion particularly in Thimphu and Phuentsholing and improve access to reliable and safe public transport to all parts of the country. Also, emphasis will be placed on making our roads safer through extensive advocacy and education programmes.

Air Transport activities will focus on expansion of facilities at Paro International Airport, enhance safety and regulatory system and upgradation of three domestic airports including the feasibility and construction of Short Take-Off and Landing (STOL) airstrips.

5.10.1 Current Situation

Surface Transport - Surface transport is the main means of passengers and good transportation. The services were provided by the government till it was fully privatized in 1991. Today there are 21 operators managing a fleet of more than 209 buses operating on more than 73 routes47. The transport operators are provided interest subsidy of 60 percent on the loan as an incentive for operating in economically unviable routes.

To address urban transportation needs, a study on Bhutan Urban Transport Systems to assess the feasibility of introducing eco-friendly mass urban transport system using clean fuel for Thimphu and Phuentsholing has been completed. The study recommends Bus Rapid Transit (BRT), high capacity buses (60 seats) which meet European emission standards, for Thimphu to be implemented under Public Private Partnership model. In the meantime, city bus services in Thimphu will continue to be provided by Bhutan Post.

To enhance public service delivery, the web-based Registration and Licensing Information System (e-RaLIS) services were launched reducing the turnaround time for issuance of new driving licenses and renewals significantly.

Air transport - Aviation services in Bhutan commenced in 1983 with Druk Air flights to Kolkata with fleet of two 18-seat Dornier 228 aircraft. Since then, aviation services have expanded to ten international routes connecting Bhutan with India, Thailand, Nepal, Bangladesh and Singapore. Currently, Bhutan has signed Air Service Agreement (ASA) with India, Nepal, Bangladesh, Thailand, Myanmar, Maldives and Singapore. Signing of ASA with the remaining SAARC countries (Pakistan, Afghanistan and Sri Lanka) have also been initiated with a larger plan to air-link all SAARC capitals. Similarly, ASA with South East Asian nations such as South Korea, Vietnam, Laos, Malaysia, Cambodia and Hong-Kong are being explored.			

With the completion of construction of Yongphula, Bumthang and Gelephu airports, domestic air services was launched in 2011 by Druk Air and Tashi Air (first private domestic operator). However, the services to Yonphula has been suspended till 2014 to complete major development works and only chartered services are available to Gelephu.

Druk Air provides international and domestic air services with a fleet of three A319 and one ATR 42-500. Tashi Air Private Limited, a private airline which started domestic services with one Pilatus PC-12, has since October 2013 started operating between Paro and Bangkok with one Airbus A320.

Air cargo transported was 620,000 tons in 2012.

5.10.2 Key Challenges

Surface transport - Road safety is a major issue with number of vehicles increasing every year. Over the last five years the number of vehicles has almost doubled with 90 percent of vehicles registered under Thimphu and Phuentsholing regions. With increase in number of vehicles, the number of motor vehicles accidents has also been on the rise with figures increasing from 696 in 200548 to 1,730 in 2011. Thimphu and Chukha Dzongkhags tops the accident list with light vehicles leading the category of vehicles involved in accidents.

Moreover, since the transport functions are carried out by number of agencies
- highway construction and maintenance by the Department of Roads, urban roads by Thromde, traffic management by the Royal Bhutan Police, licensing/ vehicle fitness by the Road Safety Transport Authority - issues of coordination and implementation is a challenge.

Air transport - Air travel is the most efficient means of travel to and from Bhutan, particularly for tourists, business travelers, foreign investors and medical referrals patients, the alternate being travel by road through India. At present, Paro International Airport caters to 160,000 passengers annually, an average of 450 passengers per day, 3800 scheduled flights annually, and about 10 flights daily in and out of Paro. A key issue is the capacity of Paro airport to serve double the number of passengers, flights and air cargo in the Eleventh Plan.

With the expansion of aviation sector, the Department of Civil Aviation is confronted with a key challenge of retaining its professionals who are being offered better remuneration and service conditions by the airline companies. Further, conflicting functions of regulation and implementation being carried out by the department is creating potential for conflict of interest. Therefore, retention of professionals and separation of conflicting function are critical issues that need to be reviewed and addressed in the Eleventh Plan.

5.10.4 Strategies

The surface transport is regulated by the Road Safety & Transport Act 1999 and air transport by the Civil Aviation Act 2000. Since both Acts were legislated more than a decade ago they will be reviewed and revised during the current Plan period.

Surface Transport - Access to public transportation, particularly in rural areas, will be expanded by incentivizing transport operators through special subsidies. In urban areas, eco-friendly mass public transportation services will be introduced to reduce road congestion, vehicle emissions and improve public service efficiency. Road safety will be strengthened by improving driver licensing procedures, motor vehicle fitness standards, public safety awareness campaigns (especially on drink driving and over-speeding) and equipping road safety authorities with necessary equipments and tools to monitor road safety.

To address the issue of coordination and implementation, integration and streamlining of transport activities under one agency will be explored.

Air Transport - The key strategy will be to strengthen Paro International Airport through expansion of infrastructure facilities and upgradation of security and navigational equipment to increase its capacity to handle more passengers, cargo and flights. At the same time, upgradation of Gelephu to an international airport will also be explored. Further, improvements of the three domestic airports will be carried out to enhance safety and reliability and to facilitate increased domestic air transport. Bhutan will continue to pursue further signing of Air Service Agreements to expand air services to and from international destinations.

The retention of professionals will be addressed through a comprehensive review of civil service system and conflicting functions will be addressed by exploring ways to ensure greater independence and autonomy of the Department of Civil Aviation. Further, the legal and policy instruments will be reviewed and strengthened.

Alternate modes of transport - To ease the pressure on air and surface transport, alternate modes of transporting passengers and goods will be explored such as waterway, ropeway, cable cars and railway links. Furthermore, the government is already exploring piloting of electric powered taxis to address environmental issues and reduce dependency on fossil fuel.

5.10.5 Key Programmes

•	Surface Transport Development - the programme will focus on the implementation of Bhutan Transport Strategies 2040, and in particular address the issues of traffic congestion in the major Thromdes by setting up the Bus Rapid Transport systems in Thimphu and Phuentsholing. In addition, alternate modes of transport will also be explored for the purpose of controlling the carbon emission.

•	Development of Air Transport - the programme will focus on further expansion of the Paro International Airport to deal with the expansion in air traffic and passengers, as well as strengthen the domestic airports to optimize their functionality.

•	Promotion of electric vehicles will be pursued to address environmental issues and reduce dependency on fossil fuel.

Programme details are presented in Eleventh Plan Volume II document."
